{
  "block": {
    "number": 0,
    "transaction_count": 0
  },
  "created_at": "2026-06-12T12:58:12.376642+00:00",
  "environment": {
    "clients": [
      {
        "id": "el-1-geth-lighthouse",
        "layer": "EL",
        "name": "el-1-geth-lighthouse"
      },
      {
        "id": "el-3-reth-lighthouse",
        "layer": "EL",
        "name": "el-3-reth-lighthouse"
      },
      {
        "id": "el-4-nethermind-lighthouse",
        "layer": "EL",
        "name": "el-4-nethermind-lighthouse"
      }
    ],
    "topology": "live kurtosis devnet"
  },
  "events": [],
  "observations": [
    {
      "bal_rlp": "0xf8d0de9400000961ef480eb55e80d19ad83579a64c007002c0c480010203c0c0c0de940000bbddc7ce488642fb579f8b00f3a590007251c0c480010203c0c0c0f840940000f90827f1c53a10cb7a02335b175320002935e6e507e3e280a0d944279b3d2755895f817cd1a6c9386e49c8047bb7f987a9c53c6c34e067ad71c0c0c0c0f84e94000f3df6d732807ef1319fb7b8bb8522d0beac02f4cb82136cc7c680846a2c01f2e782336be3e280a01e138b22e2a96eaad7b1734f25ea818da8addeeecc9b2faf3c6c86a88f1a277cc0c0c0c0",
      "client_id": "el-1-geth-lighthouse",
      "kind": "bal_output"
    },
    {
      "bal_rlp": "0xf8d0de9400000961ef480eb55e80d19ad83579a64c007002c0c480010203c0c0c0de940000bbddc7ce488642fb579f8b00f3a590007251c0c480010203c0c0c0f840940000f90827f1c53a10cb7a02335b175320002935e6e507e3e280a0d944279b3d2755895f817cd1a6c9386e49c8047bb7f987a9c53c6c34e067ad71c0c0c0c0f84e94000f3df6d732807ef1319fb7b8bb8522d0beac02f4cb82136cc7c680846a2c01f2e782336be3e280a01e138b22e2a96eaad7b1734f25ea818da8addeeecc9b2faf3c6c86a88f1a277cc0c0c0c0",
      "client_id": "el-3-reth-lighthouse",
      "kind": "bal_output"
    },
    {
      "bal_rlp": "0xf8d0de9400000961ef480eb55e80d19ad83579a64c007002c0c480010203c0c0c0de940000bbddc7ce488642fb579f8b00f3a590007251c0c480010203c0c0c0f840940000f90827f1c53a10cb7a02335b175320002935e6e507e3e280a0d944279b3d2755895f817cd1a6c9386e49c8047bb7f987a9c53c6c34e067ad71c0c0c0c0f84e94000f3df6d732807ef1319fb7b8bb8522d0beac02f4cb82136cc7c680846a2c01f2e782336be3e280a01e138b22e2a96eaad7b1734f25ea818da8addeeecc9b2faf3c6c86a88f1a277cc0c0c0c0",
      "client_id": "el-4-nethermind-lighthouse",
      "kind": "bal_output"
    }
  ],
  "provenance": {
    "bounty_eligible": true,
    "client_notes": {},
    "kind": "live_devnet"
  },
  "scenario": {
    "description": "Live Engine API BAL differential across execution clients.",
    "detector_ids": [
      "BAL_SYSTEM_CONTRACT_INDEX_CONFUSION"
    ],
    "success_condition": "Live clients return comparable blockAccessList bytes for the same payload attributes."
  },
  "schema_version": "batman.trace.v1",
  "target": {
    "eips": [
      "EIP-7928"
    ],
    "fork": "Glamsterdam",
    "spec_refs": [
      {
        "name": "EIP-7928 Block-Level Access Lists",
        "url": "https://eips.ethereum.org/EIPS/eip-7928"
      }
    ]
  },
  "trace_id": "live-20260612T125812Z"
}