{
  "schema_version": "batman.trace.v1",
  "trace_id": "trace-bal-system-index-confusion-generated-001",
  "created_at": "2026-06-11T00:00:00Z",
  "target": {
    "fork": "Glamsterdam",
    "eips": [
      "EIP-7928"
    ],
    "spec_refs": [
      {
        "name": "EIP-7928 Block-Level Access Lists",
        "url": "https://eips.ethereum.org/EIPS/eip-7928",
        "commit": "draft-as-of-2026-06-11"
      }
    ]
  },
  "environment": {
    "topology": "single-block execution differential fixture",
    "clients": [
      {
        "id": "geth",
        "layer": "EL",
        "name": "geth",
        "version": "REPLACE",
        "commit": "REPLACE"
      },
      {
        "id": "reth",
        "layer": "EL",
        "name": "reth",
        "version": "REPLACE",
        "commit": "REPLACE"
      }
    ]
  },
  "scenario": {
    "detector_ids": [
      "BAL_SYSTEM_CONTRACT_INDEX_CONFUSION"
    ],
    "description": "Generated by batman_detector.bal.fixtures. Same slot written in pre-exec/tx/post-exec phases; geth canonical vs reth folding the post-exec write onto the tx index.",
    "success_condition": "Clients disagree on BAL bytes/hash for the same minimized fixture."
  },
  "provenance": {
    "kind": "synthetic_fixture",
    "bounty_eligible": false,
    "description": "Control fixture generated by Batman. It is not evidence of a real client bug until replaced by live client outputs."
  },
  "block": {
    "number": 1,
    "slot": 1,
    "transaction_count": 1,
    "block_access_list_hash": "0x7db0dac0cceae17c6052998e8df06eac2dcc3cb8af94fea70c3360d87b897bb5"
  },
  "events": [
    {
      "event_id": "bal-pre-001",
      "kind": "bal_access",
      "phase": "pre_execution",
      "block_access_index": 0,
      "account": "0x0000000000000000000000000000000000001000",
      "storage_slot": "0x0000000000000000000000000000000000000000000000000000000000000007",
      "access_type": "write",
      "notes": "Pre-execution system hook writes the target slot."
    },
    {
      "event_id": "bal-tx-001",
      "kind": "bal_access",
      "phase": "transaction",
      "block_access_index": 1,
      "account": "0x0000000000000000000000000000000000001000",
      "storage_slot": "0x0000000000000000000000000000000000000000000000000000000000000007",
      "access_type": "write",
      "notes": "Transaction writes the same slot."
    },
    {
      "event_id": "bal-post-001",
      "kind": "bal_access",
      "phase": "post_execution",
      "block_access_index": 2,
      "account": "0x0000000000000000000000000000000000001000",
      "storage_slot": "0x0000000000000000000000000000000000000000000000000000000000000007",
      "access_type": "write",
      "notes": "Post-execution system write to the same slot (n+1)."
    }
  ],
  "observations": [
    {
      "kind": "bal_output",
      "client_id": "geth",
      "payload_status": "VALID",
      "bal_rlp": "0xe7e6940000000000000000000000000000000000001000cccb07c9c28001c20102c20203c0c0c0c0",
      "bal_hash": "0x7db0dac0cceae17c6052998e8df06eac2dcc3cb8af94fea70c3360d87b897bb5",
      "notes": "Canonical BAL: distinct indices 0/1/2 for the same slot."
    },
    {
      "kind": "bal_output",
      "client_id": "reth",
      "payload_status": "VALID",
      "bal_rlp": "0xe4e3940000000000000000000000000000000000001000c9c807c6c28001c20103c0c0c0c0",
      "bal_hash": "0x6d4849272bc0ba85fccaf05260c47810bde2e3dcfd0bee9589be2b3eae6f9a3a",
      "notes": "Index-confusion BAL: post-exec write folded onto the tx index."
    }
  ]
}
